{
  "schema_version": 1,
  "id": "nm261237-page-015",
  "document_id": "nm261-237",
  "page": 15,
  "section": "A06",
  "type": "unclassified",
  "titles": {
    "de": "Saug- und Auspuffrohr mit Vergaser (Tafel 6)",
    "en-GB": "Intake and exhaust manifold with carburettor (Plate 6)",
    "es-ES": "Colector de admisión y escape con carburador (Lámina 6)"
  },
  "source": {
    "image": "source.jpg",
    "pdf_spread": 9,
    "side": "right",
    "status": "extracted_clean",
    "display_image": "source_display.jpg"
  },
  "navigation": {
    "previous": "nm261237-page-014",
    "next": "nm261237-page-016"
  },
  "paragraphs": [],
  "figures": [],
  "status": {
    "transcription": "pending",
    "en-GB": "pending",
    "es-ES": "pending",
    "figures": "not_applicable"
  }
}
